{
  "schema_version": "1.0",
  "image": { "id": "sample_bedroom", "path": "img_dataset/Train/42.jpg", "width": 1024, "height": 768 },
  "global_vibe": {
    "scene_type": "bedroom",
    "mood": "calm",
    "brightness": 0.28,
    "warmth": "cool",
    "base_noise": "brown",
    "time_of_day": "night"
  },
  "entities": [
    { "name": "cat",    "state": "sleeping", "x": 0.22, "depth": "near", "conf": 0.91, "bbox": [0.10, 0.55, 0.34, 0.82], "source": "yolo" },
    { "name": "window", "state": "rainy",    "x": 0.80, "depth": "far",  "conf": 0.75, "bbox": [0.68, 0.15, 0.93, 0.60], "source": "fused" }
  ]
}
